{
  "$schema": "./iteration-contract.schema.json",
  "version": "1",
  "status": "draft",
  "issue_id": null,
  "pbs_leaf": null,
  "goal": "",
  "story_refs": [],
  "criterion_refs": [],
  "contract_sha256": null,
  "issues_manifest_sha256": null,
  "scaffold_manifest_sha256": null,
  "baseline_commit": null,
  "allowed_paths": [],
  "forbidden_paths": [],
  "allowed_commands": [],
  "network_policy": {"mode": "deny", "allowed_hosts": []},
  "production_loc_target": 200,
  "production_loc_max": 400,
  "total_loc_target": 400,
  "total_loc_max": 800,
  "files_target": 6,
  "max_files": 10,
  "public_interfaces_target": 1,
  "max_public_interfaces": 2,
  "scaffold_files": [],
  "contract_anchor_hashes": {},
  "verify_commands": [],
  "required_trace_refs": [],
  "requirement_delta_policy": "fail_closed",
  "debt_delta_policy": "zero_or_owner_accepted",
  "models": {"architect": null, "worker": null, "test_owner": null, "acceptor": null}
}
